NEGATIVE	Since then they have refused to return my deposit , although 17 hours notice was given , and no costs were incurred as a result , furthermore I forwarded KLM 's cancellation notification , but to no avail .
POSITIVE	Sit at the restaurant , enjoy appetizers and wine and wait to see the sunset .
NEGATIVE	SKIP the Cable Car & Rent a Car or hire a Taxi !
NEGATIVE	Skip this line skip this city .
NEGATIVE	Skip this place
POSITIVE	Smooth ride to the top .
POSITIVE	Smooth travel experience both ways and a great view .
NEGATIVE	So , 5 stars for the view from the top , but I am afraid only 1 star for the greedy money making management .
POSITIVE	So a good start and easy to find .
NEGATIVE	So a lot of money to get a birds eye view of Dubrovnik .
POSITIVE	So beautiful in so many ways ; P  
NEGATIVE	SO BEWARE   IF YOU BOOK ONLINE AND THEY CANCEL THE CABLE CARS YOU WILL NOT GET ANY KIND OF REFUND ONE VERY DISSATISFIED AND DISAPPOINTED COUPLE
POSITIVE	So glad we did !
POSITIVE	So good we went twice on different days !
NEGATIVE	So I asked her for the company address for refund and she wasnt even sure whether her company has offices in the old city !
NEGATIVE	So not a great experience and would obviously think twice about booking with this company again .
POSITIVE	So peaceful when you are up there  .
NEGATIVE	So we departed some 25min later than planned .
NEGATIVE	So we left - disappointed !
NEGATIVE	So we paid extremely high price for three taxi .
NEGATIVE	Some food at the top that was ludicrously overpriced,  just over ‰âÂ200 in case you ‰Ûª re not tracking the sums ! 
POSITIVE	Some great photo opportunities .
NEGATIVE	Some nice views but not worth the cost .
POSITIVE	Some spectacular views across the Old town and bay .
POSITIVE	Spectacular panoramic view .
POSITIVE	Spectacular view and ride .
POSITIVE	Spectacular views and a great war museum at the top .
POSITIVE	Spectacular views from the top inall directions .
POSITIVE	Spectacular views in every direction !
POSITIVE	Spectacular views of the old town and the surrounding area .
POSITIVE	Spend some time and relax above the crowds .
NEGATIVE	Spend your money on other attractions
POSITIVE	Spent a few hours at top including enjoying a meal a the restaurant .
POSITIVE	Spent a wonderful 3 hours up there !
POSITIVE	Staff great and it was a wonderful night  .
POSITIVE	Staff was courteous .
NEGATIVE	Stay away and use another company is my advice .
NEGATIVE	STAY AWAY FROM THIS COMPANY unless all you want is a ride to the top of the mountain and back .
NEGATIVE	Still , no attempt to compensate , negotiate or discount from their ridiculous quote of 213 which was more than it would have cost to book 4 individual taxis !
NEGATIVE	Still nobody showed so we called the office twice once ourselves and once by our hotel .
NEGATIVE	Still waiting for refund .
POSITIVE	Stop and have a drink in the Panorama restaurant to fully appreciate the area .
POSITIVE	Stunning fort imperial with museum highly reccommend .
POSITIVE	Stunning views , with a nice spot at the top for a drink .
POSITIVE	Stunning views from the top , worth every penny !
NEGATIVE	Such an inefficient service !
POSITIVE	Such good views at the top and on the way up .
POSITIVE	Suggest going early as lines can be long ( especially if a boat is in port ) .
POSITIVE	Sunset a great time to be on the mountain .
NEGATIVE	Super long lines to use this cable car and it 's really not worth the money or effort .
POSITIVE	Superb views of city and mountains inland .
POSITIVE	Superb views of the city of Dubrovnik .
NEGATIVE	Surely when a transfer is pre booked and the drop off address is given to the company the customer can expect to be dropped at least at a convenient place for the customer .
POSITIVE	Surprisingly there is a less-advertised war museum next to the top station which is really impressive .
POSITIVE	Swallows were swooping through the air over the path and the sun vibrated everything beautifully .
POSITIVE	swift cable car to the top of the hill , walk all the way along to the left as you come out of the tower for an amazing view over the islands .
POSITIVE	Take a break from the busy city and ride up !
POSITIVE	Take a good shoes and lot of water and walk to the hill !
POSITIVE	Take an hour to stay on the mountain , there are interesting sites inall directions !
POSITIVE	take in a bottle of wine at the restaurant at the top, reasonable prices and good service  .
POSITIVE	Take the cable car 30mins before sundown for the best experience .
POSITIVE	Take the cable car for excellent views .
POSITIVE	Take this cable car up the mountain above the old town .
POSITIVE	Take time at the top for a coffee or meal at the restaurant to savour the view .
POSITIVE	Take your camera for some of the best pics ever .
POSITIVE	Take your time walking around and enjoying the view .
POSITIVE	Takes you to the top and you can sit at the cafe / restaurant ( outside ) and enjoy the panoramic view .
POSITIVE	Ten minutes to the top and make sure you have a good day weather wise for a fantastic view .
NEGATIVE	Terrible behaviour avoid this company .
POSITIVE	Terrific restaurant at the top and excellent war museum .
POSITIVE	Terrific views and worth the money .
POSITIVE	Thank goodness the old town was preserved .
NEGATIVE	Thankfully the journey was only about 4 minutes but it was one of the most horrible , smelly , disgusting 4 minutes of my life .
POSITIVE	That 's when the adventure began .
POSITIVE	That 's where the best views were .
NEGATIVE	That is really shameful , as we have to buy a new buggy .
NEGATIVE	That ruined the night , especially when dinner was for my partners 30th birthday .
NEGATIVE	That said , whilst we were in the City the organisation and communication from the people that run the cable car was astonishingly poor .
NEGATIVE	The 2 ladies at bottom of the cable car ( where you purchase your tickets ) were extremely rude to us because it seems we could not read the sign that it was closed ) .
NEGATIVE	The ‰ÛÏ luxury minivan ‰Û is a small vehicle that can accommodate up to 21 adults , including the driver and your guide .
NEGATIVE	The activity cost a lot but was not worth the price .
NEGATIVE	The additional cost and delays to our vacation have been stressful .
NEGATIVE	The air conditioning on the mini bus only works when the bus is moving so this was a very long and warm wait .
NEGATIVE	The attitude of the cable car staff was " technical problem , not our problem " and made no attempt to assist those that were stranded .
NEGATIVE	The attraction is kind of overpriced , and you can drive up here for free .
POSITIVE	The best sunset I ever seen in my life ... Hint : get there around 7:00 pm ... spectacular !
POSITIVE	The best view i have ever seen in my life .
NEGATIVE	The boarder crossing is awful .
NEGATIVE	The bus had already been and decided to leave early and drive to our hotel even though we had been told this was no longer a meeting point .
NEGATIVE	The bus picked us up on time and the driving overall was uneventful , but the a / c had some sort of issue and I was either sweating profusely or freezing for the entire journey .
NEGATIVE	The cable and cars did not look stable enough to ride on .
POSITIVE	The cable car came second only to the OldCityWall walk for me , the ride is quick and reasonably priced and when you get to the top you are afforded some fantastic views of OldTown and the whole of Dubrovnik .
NEGATIVE	The cable car costs $37.00 Canadian for a couple of minutes .
NEGATIVE	The cable car fee of 150 Kuna seems a bit stiff to me .
POSITIVE	The cable car gives a couple of minutes ride up the hill overlooking Dubrovnik and the AdriaticSea .
POSITIVE	The cable car gives you a fast ride up to a wonderful vantage point overlooking the sea , the old city , the islands & the neighboring mountains .
NEGATIVE	The cable car is a 150k round trip with long queues and incompetent staff .
POSITIVE	The cable car is a great thing to do in Dubrovnik .
POSITIVE	The cable car is absolutely worth the ticket price .
NEGATIVE	The cable car is currently not working due to ' force majeure ' contract disagreements .
POSITIVE	the cable car is just outside the city walls and is worth going up to get the pictures of the old town .
NEGATIVE	The cable car is like a sardine box , it 's totally not worth the money or the 30 min wait to go up .
POSITIVE	The cable car is not expensive at around 100 kuna per person and we did not have to wait long for the car at either end .
NEGATIVE	The cable car is ok overrated .
NEGATIVE	the cable car is ridiculously overpriced .
NEGATIVE	the cable car is so crowded you can ‰Ûª t breath .
POSITIVE	The cable car is such a great way to get another perspective of Dubrovnik Old Town .
NEGATIVE	The cable car is too packed to really make the most of the view up or down .
POSITIVE	The cable car is well worth a visit and is easily accessible from the old town .
NEGATIVE	The cable car itself isn ‰Ûª t worth it .
POSITIVE	The cable car itself was smooth , and the views at the top were fantastic , with great photo opportunities everywhere .
POSITIVE	The cable car offers an easy and inexpensive way to reach the top of Mount Srd .
POSITIVE	The cable car ride is a great experience , it could do with going a little .
POSITIVE	The cable car ride is great , but the highlight was having lunch at the top of the hill overlooking Dubrovnik .
POSITIVE	The cable car ride provided great views of Old City Dubrovnik , setting very high ( pun intended ) expectations of our visit : Lokrum Island , Lovrijenac Fortress , the city wall, what a great introduction and overview of the Old City !
POSITIVE	The cable car trip is a must do while in Dubrovnik .
POSITIVE	The cable car was a great thing to do .
POSITIVE	the cable car was great fun !
POSITIVE	The cable card was really good and gives the best views over Dubrovnik .
NEGATIVE	The cable care ride is very short , you need to wait in a long line to get in , it runs in 2 cars , each can take up to 30 people so inside the car you can be crowded actually by people .
POSITIVE	The cable cars run from Ploce district , are regular , fast and reasonably priced .
POSITIVE	The cable takes you to the top of the mountain above Dubrovnik and gives a great view going up and down .
POSITIVE	The cafÌ© has one of the best views in the world .
POSITIVE	The cafe / restaurant looked good but we chose not eat there and returned by cable car back to town .
POSITIVE	The cafe at the top is good for coffee and a snack and of course the views .
POSITIVE	The cafe at the top was excellent as well .
POSITIVE	The cafe provides a great setting for relaxing .
NEGATIVE	The call centre is in Croatia and is staffed exclusively by extremely rude agents with poor English , who will argue with you and not bother apologising for messing up your holiday .
POSITIVE	The car itself is air conditioned which was welcomed !
NEGATIVE	the car was absolutely packed , we were like sardines and as I found on the descent it was impossible to see anything .
NEGATIVE	The car was not clean , and when we escaped the traffic driver was driving way above speed limits .
POSITIVE	The cocktail bar at the top has got VERY good looking waiters .
NEGATIVE	The company cancelled my Val D'isere to Geneva Airport transfer with < 2hrs notice , said they could pick me up an hour late which ( with Easter Monday ski resort traffic ) would likely make me miss my flight .
NEGATIVE	The company offered no solution or alternative .
NEGATIVE	The couple in front of us asked the sullen " gatekeeper " why hordes were allowed through when we had been queuing for an hour her answer was " they are a group " !
POSITIVE	The crystal clear sea , the old walled town of Dubrovnik , the islands , and the mountains behind .
POSITIVE	The day we went was clear & spectacular views !
NEGATIVE	The drive from town to Dubrovnik airport was disaster .
NEGATIVE	The driver arrived after half an hour .
NEGATIVE	the driver basically would stop at various places and tell us " 15 minutes " - we were left to our own devices in trying to figure out what we were to look at .
NEGATIVE	The driver did not show for this despite us paying the deposit .
NEGATIVE	The driver did not show up to collect us , despite having confirmation emails the day before , and we were left stranded .
NEGATIVE	The driver got to the hotel 1 hour late .
NEGATIVE	The driver kept saying it was the parent 's responsibility in croatia for the seat and then proceeded to try to fit the seat incorrectly before I stepped in .
NEGATIVE	The driver phoned the apartment for instructions and was told to take us to Pile gate but he decided not to because the traffic had been bad and he would be late for his next pick up .
NEGATIVE	The driver showed up 11:30 , and he told me that he had informed the company around 10 o'clock that he would be half an hour delayed , and that he asked them to inform me .
NEGATIVE	The driver spoke little English and never gave us any sort of narration .
NEGATIVE	The driver took us on a route driving quickly on a motor way and the safety of my child was put at risk .
NEGATIVE	The driver was 30 minutes late .
NEGATIVE	the driver was also late in collecting us and we only made our ferry transfer by the skin of our teeth .
NEGATIVE	The driver was late for pickup , which ok , can happen but then 20 minutes late for our return to the airport - no contact made about any delay .
NEGATIVE	The Dubrovnik Cable car is a huge waste of money and better viewpoints can be seen renting a car ( which is also more cost effective if you are traveling a group ) .
NEGATIVE	The entire process was a debacle and previous reviews show they have no concept of customer service .
NEGATIVE	The evening before the transfer ( which was early in the morning ) I get a call from their customer service saying they made a mistake when calculating the fare , and it is actually 160 EUR ( 50EUR more ) .
POSITIVE	The experience was fantastic with a spectacular view of the old city .
NEGATIVE	The facilities are rubbish .
NEGATIVE	The first was in Berlin in 2017 and I withdrew my complaint and my complaint for the company 's apology and its offer to compensate for their incompetence .
POSITIVE	The fort is great to go to & the museum inside is was only 30 kuna for our family .
NEGATIVE	The GORAN I SPOKE WITH SAYS HES DOESNT HAVE A MANAGER HE ‰Ûª S JUST CUSTOMER SERVICE apparently he can ‰Ûª t answer questions because his dispatcher is waving at him .
POSITIVE	The gorgeous views made it all worth while .
NEGATIVE	The guide from the minibus picked up two other tourists then wanted to leave immediately , without even looking at us .
POSITIVE	The higher priced drinks might be worth it for more uninterrupted views .
POSITIVE	The homeland war museum is also an interesting visit .
NEGATIVE	The interior of the car was stinking after cold cigarette smoke and driver was chasing like there is no tomorrow .
NEGATIVE	The intial amount was refunded but the waiting charges weremt .
NEGATIVE	The issues were as follows : - Purchased tour clearly says ‰ÛÏ minibus ‰Û and ‰ÛÏ 18 persons is the maximum for this tour ‰Û  but everything was false.
POSITIVE	The journey up takes about 5 mins but the views going up and from the top are spectacular .
NEGATIVE	The lady at the ticket booth did not warn me that the route back would be so dangerous .
NEGATIVE	The line for the tram to get up and again down we ‰Ûª re horrible the Sunday sunset we were there .
NEGATIVE	The male running the cable car said he had phoned to the restaurant and shop but nothing had been handed in which I thought unlikely as the waiter would have seen them as he was heading to clear the table when we were leaving .
NEGATIVE	The manager is very rude and has no customer service .
NEGATIVE	The money was taken in CASH upfront and little did we know what we were getting ourselves into .
NEGATIVE	The most annoying part is there is no contact from the company at all .
POSITIVE	The Museum at the top is worth a visit too .
NEGATIVE	The office were extremely unprofessional , refusing to talk to us on the phone , and would not come to any agreement on their mistake , leaving us backed into a corner with the driver , holding us in the car on the side of a motorway and having to pay double the initial cost only so we did not miss ...
POSITIVE	The Old fort has an excellant portrayal of the 1991 war and the restaurant is great for lunch , dinner or just having a drink  .
NEGATIVE	The only reason we didn ‰Ûª t miss our flight was due to a flight delay .
NEGATIVE	The only thing up the top other then the view is a massive mobile phone mast and a exhibition you have to pay extra to go into .
NEGATIVE	The only way down is via a VERY BUSY , VERY DARK STREET , where there is no shoulder or sidewalk to walk on and the cars are going VERY FAST .
NEGATIVE	The operator staff need some training in customer service before would consider this again .
POSITIVE	The opportunity to take a cable car ride should not be missed .
POSITIVE	The pan tile rooftops look gorgeous looking down from above them .
POSITIVE	The panorama restaurant at the top was not too expensive and is well worth it for the views .
POSITIVE	The panoramic views of the islands and the mountains are spectacular .
NEGATIVE	the path is very dangerous and takes two hours .
NEGATIVE	The people waiting to come down again have to queue up in the hallway where all foot traffic is so there is a jam of people trying to move in 3 different directions at once .
NEGATIVE	The people who book here taxis and maybe somewhere else the prices ar unfurtunately different anyway !
POSITIVE	The perfect way to get a bird 's eye view of the city .
NEGATIVE	The place is crowded in summer so changing rooms are busy and there is a lot of people around .
NEGATIVE	The price is shocking and they make it impossible to use other good value public transport to see the miseum we badly wanted to see at the top .
NEGATIVE	The price of the cable car is far too expensive .
NEGATIVE	The prices seem to be based on the altitude rather than the experience - ie , they are high .
NEGATIVE	The problem is there isn ‰Ûª t much to see on top after you spend the 150 kuna , at least definitely not worth spending the money .
POSITIVE	The progress that has been made in Dubrovnik since the 1990s is quite incredible .
POSITIVE	The ques are worth the wait .
POSITIVE	The queues are long and it is hot standing about but it is worth every minute of it .
NEGATIVE	The queues for this ride were too long .
NEGATIVE	The queues were horrendous .
NEGATIVE	The receipt does not reveal the price with clarity ( maybe for fiscal pr shared money in our presence .
NEGATIVE	The reserved money is no longer reserved it ‰Ûª s charged to my account and I have a bank statement to prove it .
POSITIVE	The restaurant appeared to be good value although we only stayed for drinks .
POSITIVE	The restaurant at the top does a really nice steak sandwich ( happy to let two people share )  
POSITIVE	The restaurant at the top is a great place for a snack .
POSITIVE	The restaurant at the top is lovely with beautiful views .
POSITIVE	The restaurant at the top was really good too  .
POSITIVE	The restaurant nearby and museum in the fortress are well worth a visit .
POSITIVE	The restaurant on top was good aswell , and not particularly expensive .
POSITIVE	The restaurant Panorama is really worth a visit to savour the sights and enjoy the breath taking scenery here .
POSITIVE	The restaurant there is fantastic , perhaps it 's best to book if you want a table right on the veranda , however we did not book and had a nice table .
POSITIVE	The ride is fast and smooth and the 360 degree panoramic views from the top are spectacular .
POSITIVE	The ride is lovely , ifnot brief .
NEGATIVE	The ride itself only lasts a few minutes and you have better views from the top than from the car .
NEGATIVE	The ride lasted minutes , and the high winds at the top were so high we dived into the shop where the prices were too high to even consider buying a memento of the trip .
NEGATIVE	The ride lasts less than 5 minutes and it is way too expensive .
POSITIVE	The ride to the top is fun , if crowded , but the view at the top is great .
NEGATIVE	The ride took so long cause out of the 18 people on the bus 2 of the passengers had paid for a trip to mostar and medjugorje they had said this at the start of the trip but were taken anyway .
POSITIVE	The ride up is quick and the views are spectacular !
POSITIVE	The ride up only takes a few minutes but once you up at the top the view is incredible , we ate at the outside cafe and had the club sandwich which was lovely and reasonably priced .
POSITIVE	The ride was smooth and the waiting lines atthebottom and top went quickly .
POSITIVE	The ride was smooth and worth the cost .
NEGATIVE	The ride was totally stressful and waste of 220 euros we spent for a 3 hour ride !
NEGATIVE	The road had neither pavements or crossings at this point , so we had to run the risk of crossing the road with our suitcases .
NEGATIVE	The roundtrip ticket was $25 , which was kinda pricy .
NEGATIVE	The same morning of our transfer , only 2 hours before departure , we received a call telling us ‰ÛÏ the car is not fit for the journey ‰Û and that it would not show up .
NEGATIVE	The scenery and the photo you can take just isn ‰Ûª t worth the money .
NEGATIVE	The service team were not honest .
NEGATIVE	The service was 10min late although the driver did try to advise of the delay about 20min before citing traffic .
NEGATIVE	The service was rude ( as shown by the picture on the boat , if you don ‰Ûª t tip more than ‰âÂ3 per person they don ‰Ûª t want to know ) so I would highly recommend doing something else with your money .
POSITIVE	The sightseeing from the city is wonderful !
NEGATIVE	The sign at the cable car entrance stated that the operators had not complied with payments and regulations .
NEGATIVE	The skyline is extremely short and the cable cars were crammed with tourists on the day we attempted to use it ; and we are SO glad that we were deterred by the crowds !
NEGATIVE	The staff are rude .
NEGATIVE	The staff was were very very rude and refused to budge , spoke in high tone in take or leave it .
NEGATIVE	The staff zoned off the exit and prioritized a bus load of other tourists .
POSITIVE	The sunset we experienced at Panorama restaurant on Mount Srd was spectacular and will stay with me forever .
NEGATIVE	The taxi driver on the leg back was 40 minutes late , did not apologise and blamed the traffic .
NEGATIVE	The taxi we 'd booked , FAILED TO ARRIVE !
NEGATIVE	The ticket is very expensive .
NEGATIVE	The title and description of this excursion are not true what so ever .
NEGATIVE	The tour company was incredibly rude on the phone and bus driver expected us to go on the tour leaving our son behind .
NEGATIVE	The tour was rushed and hurried all along and times were cut short .
NEGATIVE	The trip itself lasted 2 minutes where I saw virtually nothing due to the amount of people in the car itself .
POSITIVE	The trip to the top by cable car is definitely worth the money .
POSITIVE	The trip up and down is well organised with very helpful staff .
NEGATIVE	The truth is : they have overbooked in the minibus tour as they said the minibus was full and therefore put me into the another big coach tour !
POSITIVE	The view at the time is spectacular and makes it so easy to get your bearings in Dubrovnik .
POSITIVE	The view from it is spectacular .
POSITIVE	The view from the 400m-high summit takes in the the walled city itself , the scattering of beautiful Elaphiti islands and , on a clear day , the neighboring country of Montenegro .
POSITIVE	The view from the cable car platforms at the top are great but there is a wonderful serenity on the Rope Walk ( starts just north of the ruined building next to the cable car station ) .
POSITIVE	The view from the top Is amazing ! 
POSITIVE	The view from the top is amazing .
POSITIVE	The view from the top is fantastic - there is a lovely bar where you can enjoy a drink and / or a snack while you soak it all in .
POSITIVE	The view from the top is fantastic .
POSITIVE	The view from the top is sensational .
POSITIVE	The view from the top is spectacular of course .
POSITIVE	The view from the top is truly spectacular !
NEGATIVE	The view from the top was obstructed by the cable car itself and you can not really get around it . 
POSITIVE	The view from the top was spectacular !
POSITIVE	The view is amazing .
POSITIVE	The view is great , and you will see the entire old city , surrounded by the " new " city .
POSITIVE	The view is great from there , plus the added benefit of both a restaurant and a museum .
POSITIVE	The view is incredible .
POSITIVE	The view is nothing short of incredible with a 360 view of the old town , surrounding city and the near by mountains .
POSITIVE	The view is so impressive just as it is !
POSITIVE	The view is stunning , on a cloudy , windy day , they even supply blankets : - coffee , icecream and a blanket - perfect .
POSITIVE	The view is stunning though the one from the top of the fortress is even better .
POSITIVE	The view of Dubrovnik and AdriaticSea is spectacular !
POSITIVE	The view of Dubrovnik from Srd hill is beautiful .
POSITIVE	The view of old town and sea is so spectacular .
POSITIVE	The view of red roofs of houses with deep blue sea are breathtaking .
POSITIVE	The view of the city is superb and really helps you understand the layout so much more easily .
POSITIVE	The view of the old city from this vantage point is absolutely stunning .
POSITIVE	The view of the old town & beyond & the sea is just beautiful .
POSITIVE	The view of the walled city and beyond is superb .
POSITIVE	The view of the Walled town is very good .
POSITIVE	The view on a clear day is breath-taking .
