NEGATIVE	Unfortunately the staff member loading passengers for the return trip decided we were to dirty to stand in the car and refused us entry .
POSITIVE	Unfortunately we were not there at an appropriate time to do so but we enjoyed the experience .
NEGATIVE	Unless you are willing to spend 1 -/2 hours each way waiting in line you will not get on it .
POSITIVE	Up top the view is amazing .
NEGATIVE	Upon arriving for the 2pm tour we were told they dint have enough people and again tried to sell us a private tour .
POSITIVE	Various viewing platforms to choose from including a lovely amphitheatre area and a monument at the top .
NEGATIVE	very bad customer service .
NEGATIVE	Very bad service .
NEGATIVE	Very confusing .
NEGATIVE	Very confusing and surreptitious terms and conditions .
NEGATIVE	Very disappointed , we had our day planned and they not only did not show up , and treated us rudely when we called to ask where the driver was .
NEGATIVE	Very disappointed .
NEGATIVE	Very disappointing service - what a way to ruin a holiday .
NEGATIVE	Very expensive at roughly å£35 return ride for two of us .
POSITIVE	View at night is just spectacular .
POSITIVE	View from the Srd hill is amazing .
POSITIVE	View from the top is fantastic to take pictures of the whole city , restaurant was great to grab a drink .
POSITIVE	View from the top is great .
POSITIVE	Views amazing from the top .
POSITIVE	Views are great !
POSITIVE	Views are spectacular !
POSITIVE	Views are spectacular .
POSITIVE	Views are stunning and make sure you book the Restaurant Panorama for a meal or drinks to enjoy the stunning view from the top .
POSITIVE	Views are worth waiting in line if you had to !
POSITIVE	Views of Dubrovnik and the AdriaticSea are spectacular .
POSITIVE	Views of old town and coastline are fantastic .
POSITIVE	Views of the old city are breathtaking .
POSITIVE	Views were spectacular .
POSITIVE	Views were unbelievable , fantastic view over the town .
NEGATIVE	Virtually all photos will be spoilt by the cable car pylon and / or cables .
POSITIVE	Visit the outside restaurant which has great service & their steak sandwiches are the best  .
POSITIVE	Visitor centre at the top has clean toilets .
NEGATIVE	Waiting for 35 mins was not reasonable especially when we had a flight to catch .
NEGATIVE	Walk the wall instead !
POSITIVE	Walking down is lovely as there is a reasonably good path walk and there are spots where you can stop and soak in the view - it takes about an hour if you walk at a reasonable speed .
POSITIVE	War museum is fascinating and well worth spending some time there .
NEGATIVE	Was closed .
NEGATIVE	Waste of money
NEGATIVE	Waste of money å£18 to travel 4 minutes return on a squashed cable car !
NEGATIVE	Waste of money and waste of day .
POSITIVE	Watching the sunset from the roof of the old fort / war museum is great .
NEGATIVE	Way overpriced for the couple of minute view as you ascend .
NEGATIVE	We accepted that disasters can happen but this is unforgivable
POSITIVE	We all enjoyed it and it was definitely worth the wait .
POSITIVE	We also had a couple of drinks in the restaurant that sits on the mountainside overlooking the bay - a seat on the edge affords the best views .
POSITIVE	We also had a nice meal in the restaurant near the cross with Panoramic views over the city and bay .
POSITIVE	We also visited the war museum which is housed in a building behind the visitor centre and which gave great insight into the homelands war , we had not been aware it was there but well worth a visit .
NEGATIVE	We are still awaiting our deposit back and the suggestion of a 5 % discount on a future booking is not very appealing in terms of compensation .
NEGATIVE	We are unlikely to return as its a long time since we were ripped off so much in one city and we take a short break somewhere in Europe about once a month
NEGATIVE	We argued and said the route instructions were not specified on the website .
POSITIVE	We arrived at around 6pm , and although a queue was beginning to form , we only waited around 15 minutes until we could board the car .
NEGATIVE	We booked a transfer from Sarajevo to Dubrovnik and could not be more disappointed .
POSITIVE	We both loved it anyway , and did not want it to end .
POSITIVE	We caught the cable car and the views down across the city are fantastic .
POSITIVE	We could not stop staring at it .
POSITIVE	We could not stop staring at it, wonderful .
NEGATIVE	We decided not to bother as it was about å£12 per person and the ques were long .
POSITIVE	We decided to have dinner in the Panoramic restaurant - great service and food and we were able to watch the sunset and get some fabulous photos .
POSITIVE	We did it in the evening in the dark as I do not like heights so this was perfect .
NEGATIVE	We did not feel safe, BE CAREFUL !  
NEGATIVE	We did not get back to Dubrovnik until 9:00 PM because everything got delayed .
NEGATIVE	We did not have a good experience with our return transfer .
POSITIVE	We did not have to cue long from the top and purchased out tickets from the souvenir shop at the top .
POSITIVE	We did not wait long to ride the cable car - perhaps we timed it right as it was suggested early in the day might be quieter .
POSITIVE	We did the ride up as a part of a private walking tour with a fabulous guide , Ivo from Access Dubrovnik tours , and were given lots of interesting information about what we were looking at .
NEGATIVE	We dont recomed it to nobody !
NEGATIVE	We ended up having to book a private transfer over to Hvar but Connecto still insisted on charging us the full amount ( even though they had not even booked our ferry tickets ) .
NEGATIVE	We ended up on a hazardous route as the driver simply did not understand what he was doing .
NEGATIVE	We ended up spending only about 20 minutes up there as there is nothing else to do and I would only recommend if you a ) have the Dubrovnik city card or b ) like throwing money away .
POSITIVE	We enjoyed the exercise and the village showed its interesting tale of the 1991 Serb / Croat war .
NEGATIVE	We found the whole experience very frustrating and though we got on easily at the bottom we were forced to queue down and round flights of stairs with people trying to shove by and push in at every opportunity at the top .
POSITIVE	We got into the cable car at 7:30 pm ( best time to go ) and once we were at the top the view was beautiful .
NEGATIVE	We got on the tour last minute , but we were overcharged from the stated price .
NEGATIVE	We got some excuses from the lady , but for me , the service is not reliable if they don ‰Ûª t even show up in time !
POSITIVE	We got the No5 bus straight from our hotel to the Cable Car , the bus stop is literally outside !
NEGATIVE	We had 2 days of private transfer and tour from Zagreb to Ljubljana which were rather expensive .
NEGATIVE	We had a 15 minute break from driving at about 9am and at no point were we told that we would not be able to get off the bus at the border and the wait could be up to 4 hours .
POSITIVE	We had a day in Dubrovnik which was amazing and no problem to get on the cable car in the free time we had .
POSITIVE	We had a great time .
POSITIVE	We had a lovely light lunch in the open restaurant which was great value for money and we were not rushed to vacate our table .
NEGATIVE	We had a minimal time at the waterfalls ( about 45 minutes ) and in Mostar ( about 2 hours ) .
NEGATIVE	We had already checked out from the hotel and we were waiting for the car .
POSITIVE	We had coffee at the restaurant which was nice !
POSITIVE	We had coffee in the cliffside cafe ` , asusual the coffee was cold , but the waiter was really charming and brought some hot milk .
POSITIVE	We had lunch at the Panorama restaurant which , for somewhere so touristy , is good value and quality .
POSITIVE	We had lunch up there , not as over priced as we had thought it might be , fantastic morning out  
NEGATIVE	We had no choice but to book it , costing us ‰âÂ400 !
NEGATIVE	We had the messing about to do to find another trip ( which we did with another company ) and also getting a refund but appreciate that it was an oversight by the company but this does not help you when you were so looking forward to it .
NEGATIVE	We had the worst experience with Connecto Transfer .
NEGATIVE	We had to arrange a new transfer from Montenegro because of that and it was more expensive also .
POSITIVE	We had to sit in the restaurant / bar for a coffee overlooking all this spectacular scenery .
NEGATIVE	We had to skip the walking tour as I was about to pass out due to hunger .
NEGATIVE	We had to wait maybe 10-15 minutes to get on , which isn ‰Ûª t the issue .
POSITIVE	We had two champagne cocktails , a large water and two meals for å£35.00 ( including 3 % card fee ) which was very reasonable for what was a lovely lunch .
NEGATIVE	We have 2 yrs old child and waiting was painful .
NEGATIVE	We have traveled a lot and these people left us a bad memory .
POSITIVE	We hiked between intact mine fields to reach the summit .
POSITIVE	We just made the sunset and seen some great views .
NEGATIVE	We knew our transportation there was the cable car , but we didn ‰Ûª t know it was the ONLY available transportation , and they quit running down at the slightest hint of rain .
NEGATIVE	We landed and when collecting our baggage they called , expecting them to notify us they were waiting for us , but instead they told us they were cancelling our 1.5 hour transfer leaving 6 22 year old girls stranded in Croatia when the final destination was Montenegro .
NEGATIVE	We learnt an awful lot .
NEGATIVE	We left all alone and without knowing what to do .
NEGATIVE	We literally paid for a ride and a guy who said ‰Û÷ you have an hour and half to explore , meet me back here ‰Ûª in both Kotor and Budva .
POSITIVE	We loved it .
POSITIVE	We loved the restaurant & views are stunning from the top , over looking all of Dubrovnik town and harbour .
NEGATIVE	We made it back to our ship just in the nick of time ( with my son very upset and anxious ) when we should have been back hours earlier .
POSITIVE	We managed to get in to the front of the cable car on the way down and had fantastic views .
NEGATIVE	We missed the cable car and the buggies .
NEGATIVE	We ordered minibus , but when we arrived there was no minibus only just two cars with very high price .
NEGATIVE	We paid 15 days in advance , then tried to call them but no one picked our call , they did not give our mail reply .
NEGATIVE	We paid 19 euro for the cable car , arriving there , we were disappointed , the only thing you see is Dubrovnik town and old town , nothing else , I do not recommend it ,
POSITIVE	We particularly enjoyed lunch at the Panorama restaurant at the top .
NEGATIVE	We prepaid for a return transfer from the airport to Dubrovnik , unfortunately the transfer never turned up & we had to pay for a taxi instead , the customer service was not good & this stressed us out !
NEGATIVE	We queued for over an hour , which we expected , however as we approached the turnstile two HUGE groups of cruise ship passengers approached with bulchy guides who pushed thorugh all of the queue and proceeded to let over 200 passengers on who didnt have to stand in the queue .
NEGATIVE	We raised an objection for using our card unethically without our approval .
POSITIVE	We read all the reviews and knew it was going to be pricey but it is really worth it .
POSITIVE	We really enjoyed the CableCar and the views from the terrace are spectacular .
POSITIVE	We recently took the cable car and sat at the top to enjoy the view and relax - it was well worth the time .
NEGATIVE	We refused so they said they would take our number and whats app us when they had another two people so the group tour could proceed .
POSITIVE	We returned at dusk for some great nightime pictures of OldTown  .
POSITIVE	We sat in the open air restaurant with an ice cream and drink and enjoyed an hour of relaxation .
NEGATIVE	we saw some very dangerously dehydrated people !
NEGATIVE	We send 1,5 hours trying to solve the problem , but the company did nothing .
NEGATIVE	We shopped at the top and the rude associate took the money right out of my hands and counted it wrong .
POSITIVE	We some drinks in the panorama restaurant at the top ( which is great for raking in the views ) before heading back down .
NEGATIVE	We spent a considerable amount of time trying to find the trailhead to hike up ( and saw people on the mountainside hiking ) but we were never able to locate it or get any help for the useless TI in town .
POSITIVE	We spent a good couple of hours up here and got some really great snaps .
POSITIVE	We spent about an hour at the summit to take in the gorgeous sunset .
NEGATIVE	We spent more time queuing then the actual time up the top , with a view you can get from a short walk or shorter car journey .
NEGATIVE	We stood for 20 minutes with 2 employees not doing much .
POSITIVE	We stood on the right for the descent and had lovely views of sunset at approx 8pm .
POSITIVE	We stopped for a beer in the beautiful restaurant at the top , certainly a drink with a view .
NEGATIVE	We then phoned every taxi , transfer and bus in the area and further afield to be told everything but one car was booked .
NEGATIVE	We then received a cancellation mail .
NEGATIVE	We therfore travelled by taxi at additional cost , some passengers were returning to cruise ship and were at risk of missing their transfer back to the ship .
NEGATIVE	We thought there would be a viewing platform with 360 å¡ views but no , pretty much only 180 å¡ .
POSITIVE	We timed it perfectly as there were only a few people ahead of us waiting in line .
NEGATIVE	We told this to the driver 4 or 5 times and were told he knew where he 's going .
POSITIVE	We took it up to the top for dinner and watched the sunset - completely worth it !
POSITIVE	We took the cable car in the last night of our holiday and really enjoyed the views .
POSITIVE	We took the cable car up but decided to walk down .
POSITIVE	We took up a beer to enjoy , many people also had done this too .
POSITIVE	We ventured out of the main viewing area to see the sunset - it was spectacular .
NEGATIVE	We waited 15 mins before we contacted the office to give them the benefit of any doubt but it was a disaster .
NEGATIVE	We waited 25 mins and finally hailed a taxi off the street and left .
NEGATIVE	We waited a long while for the cable car to go , even though there were more than enough people and the cable car was sat there waiting .
NEGATIVE	We waited and were given maps in the wrong language , and when I asked for one in English she said ‰ÛÏ it doesn ‰Ûª t matter ‰Û .
NEGATIVE	We waited for 2 hours at the border and we were not allowed off the bus because the Bosnian officials ' would not like it ' .
NEGATIVE	We waited for 30 minutes and no one arrived .
NEGATIVE	We waited for 45 min , and then called the Company , they told us they would there right away - after another 45 min we took a taxi .
NEGATIVE	We waited for the bus an hour past the appointed pickup time in Kotor .
POSITIVE	We waited in line for about 30 minutes , but it was well worth the wait .
NEGATIVE	We waited in the baking sun for 10 minutes before the cable car accelerated from its holding point .
POSITIVE	We walked around and then sat down in the restaurant to enjoy some refreshment .
POSITIVE	We walked down the views got better and better as we descended .
NEGATIVE	We wanted a small tour , which is why we paid more money for this tour over similar tours .
POSITIVE	We wanted to take photos of the sunset over the city but because we were there in October the sunset was over to the west coastline and islands - still beautiful .
POSITIVE	We watched the sunset and it was great !
POSITIVE	We went about 6.30pm and there were no queues and it was mid July ( it 's very busy during the day apparently ) so still lovely sunshine but a bit cooler - straight to buy a ticket and the car pulled up to the turnstile .
POSITIVE	We went just before sunset on a gorgeous hot day .
POSITIVE	We went on a busy day and had to wait 15 mins or so before we could get on board , but it was well worth the wait .
POSITIVE	We went on the cable car just before sunset , it was absolutely fantastic .
POSITIVE	We went on the cable car ride on 13/05/18 this was the first time in a cable car so slightly nervous but wow so glad we did it . 
POSITIVE	we went on tour to this the view was priceless what an experience is must go and look out this beautiful city is must go place .
POSITIVE	We went up at sunset and got great views of Dubrovnik and of the setting sun and the rising moon !
POSITIVE	We went up early and had a wonderful view over the city .
POSITIVE	We went up for sunset and stayed til 8 .
POSITIVE	We went up in the day time and could see for miles !
POSITIVE	We went up in the evening to catch sun down which was truly beautiful .
POSITIVE	We went up just before sunset to enjoy some beautiful colors .
POSITIVE	We went up late afternoon to get a good light for our photographs .
POSITIVE	We went up on a clear day about 1pm the views of the old city are spectacular also the panoramic views are amazing .
NEGATIVE	We were also overcharged after requesting to pay in the local currency instead of euros so beware when doing so if you are silly enough to use this company .
NEGATIVE	We were also told multiple times that going through the Bosnian check points the guards on duty may take coffee money off us as they are corrupt .
NEGATIVE	We were called stupid a few times that day .
NEGATIVE	We were extremely unsatisfied and would not recommend it to anyone .
NEGATIVE	We were finally ushered into a much larger minibus for about 20 people .
POSITIVE	We were lucky and had only to queue for about 15mins ( the cabins leave every 5mins ) .
POSITIVE	We were lucky to get a very clear day and the vies were truly beautiful .
POSITIVE	We were lucky to have a nice sunny day .
NEGATIVE	We were not able to use it and I was left with no choice but to travel with my baby son on my lap .
NEGATIVE	We were not allowed on the gondola .
NEGATIVE	We were not contacted to say this was going to be the case .
NEGATIVE	We were not informed in advance that this was to happen Jan Sweden
NEGATIVE	We were not prepared however to be dropped at the North City gate which meant we had 123 steps to carry our luggage down .
POSITIVE	We were not really sure whether this would be worth it but I am so glad we did it - there was an absolutely spectacular view and I would highly recommend it to anyone !
NEGATIVE	We were one of the 1st couples to be dropped off in Dubrovnik at 8.15pm making it a 12 hour day .
NEGATIVE	We were only four people in 8 seater car , we were forced to seat in last .
NEGATIVE	We were picked up in a small van with just a driver .
POSITIVE	We were planning on going up just to see the view , then coming back down , but we ended up eating at the restaurant and having drinks , a nd staying until sundown .
NEGATIVE	We were recommended this tour but it really was not worth doing .
NEGATIVE	We were rip-offed slightly as we chose to do the cable car when we first arrived in Dubrovnik .
NEGATIVE	We were shuffled to a large coach bus and when I inquired with the tour guide about the minibus I was brushed off and told ‰ÛÏ sometimes they overbook and use the coach bus instead ‰Û .
NEGATIVE	We were so disappointed with this attraction .
NEGATIVE	We were sold ticket in basis of 10min wait,  when reaching queue it reflected more than an hour so we asked for a refund and came away !
NEGATIVE	We were staying in the old city and instead were dropped off 15 minutes away .
NEGATIVE	We were stopped by one of their hawkers offering walking tours and tried to book to go on a group walking tour .
NEGATIVE	We were to go to Budva , did not go there at all .
NEGATIVE	We were told someone would call us back .
NEGATIVE	We were transferred on numerous occasions throughout Croatia and none were nearly as terrible as this .
NEGATIVE	We were travelling from salzburg to germany tried calling customer care since two days for change in pick up timmings but could not get through even dropped mail on day of pickup got mail that they can not change timming so we came down on time after waiting for 15 min.
NEGATIVE	We were very disappointed and had to make a few phone calls .
NEGATIVE	We were waiting for the tour at the designated spot when the driver finally called to say that the tour got cancelled .
NEGATIVE	We were worried we would not make our ferry .
POSITIVE	Weather was nice and so surprisingly there was not alotof people .
NEGATIVE	Website is well-designed and seems like a real company , but your credit card will be charged in Croatian Kuna with a whacking great FX fee .
NEGATIVE	Well , consider it a sign of high customer service the reply ....
NEGATIVE	Well I was not disappointed once we reached the summit the views and scenery were fantastic .
NEGATIVE	Well it started with the ginormous earthworks happening across the road from the cable car entry, not anyone ‰Ûª s fault , but gave me a terrible pounding headache .
POSITIVE	Well priced , only buy tickets from official stores .
POSITIVE	Well priced and good fun . 
POSITIVE	well worth a couple of hours out of your day or evening just for the views .....
POSITIVE	Well worth doing .
POSITIVE	Well worth going up the cable car for the fantastic views over the town of Dubrovnik .
POSITIVE	Well worth it !
POSITIVE	Well worth it for the superb view of the harbour and old town of Dubrovnik .
POSITIVE	Well worth it though as the views are stunning .
POSITIVE	Well worth queuing for , quick and easy to purchase tickets and board car .
POSITIVE	Well worth the climb to go on this cable car it was lovely to sit in cafe at the top nand badmire the view .
POSITIVE	Well worth the money .
POSITIVE	Well worth the price to soar above the city and the old town .
POSITIVE	Well worth the trip to the top , the views are amazing .
POSITIVE	Well worth the wait in the queue - if we had got there abit earlier I am sure it would not have taken so long .
POSITIVE	Went during the day as I think at night you would not really see the old town in all its glory  .
POSITIVE	Went up and back on the cable car and was treated to stunning views on the way and once at the top with a little walking you can get surrounding city view , excellent  .
POSITIVE	Went up on a lovely sunny day and the views were fantastic .
POSITIVE	What a great call !
POSITIVE	What a great experience !
NEGATIVE	What a waste of time .
NEGATIVE	WHAT I EXPECTED ( AND PAYED FOR ) : A Mercedes , with AC , ready to pickup me and my girl at the SPU airport and drop off us door to door at Riva Hotel in Hvar   that 's what their FAQ website sais they do as following : " Will I be dropped off at my accomodation ?
NEGATIVE	What kind of business agrees to provide a service for a certain amount of money , then puts you in a position to be forced to pay 50 % surcharge for their mistake ?
NEGATIVE	What let this trip down was the cost , the 120kn return ticket does not even cover the cost of the entry into the museum , which is an additional 30kn .
POSITIVE	What we didn ‰Ûª t realise is that the path is very uneven , rough and not at all easy to walk on in flip flops and crocks due to stones of various sizes .
POSITIVE	Whatever you choose , it 's time and money well spent !
NEGATIVE	when driver arrived he refused to take us stating that he had order from connecto for 08 passengers and his vehicle has maximum capacity for 8 passengers .
NEGATIVE	When I arrived home and made a formal complaint , it was explained to me that in fact , this company hires other companies to do the work and it had failed to make the booking for us .
NEGATIVE	When I asked them about it they said the supposed cars have had accidents on the way to my pickup .
NEGATIVE	When I asked these people if this was true , they did not acknowledge that a note exists .
NEGATIVE	When I came back down I asked if I could get a refund and instead I was given a leaflet and told I could make a complaint if I liked .
NEGATIVE	When I complained they advised if passenger misses a connecting flight or any other form of transportation due to circumstances not directly under their control , they can not be held accountable , or expected to cover the resulting expenses .
NEGATIVE	When I contacted the company to cancel our return booking and complain about the drop off I was told that they determine were the drop off will be not the customer and we were dropped there because it was convenient for the driver because he was running late for his next pick up .
NEGATIVE	When I feared I was going to miss the flight , I rang the head office to beg them to tell the taxi driver to turn around and take the motorway .
NEGATIVE	When I tried to call them , there was no answer , there is no telephone support out of hours .
NEGATIVE	When I tried to complain about this I was told that a private transfer to the hotel would have been a lot more expensive .
NEGATIVE	When phoning the call Centre we were informed that our transfer was cancelled .
NEGATIVE	When reached the beginning of the old town , guess what all clobbed flooring , my mum was unable to walk on that .
NEGATIVE	When she was questioned on it she accused people of not listening to her carefully .
POSITIVE	When the car stops go up to the top of the building for an even better view .
NEGATIVE	When the company called to confirm our trip yesterday we were told we could get by on credit card and no need for Euros, in Perast there were fees that our driver covered and despite paying $80 a person for a not so guided tour he made sure we took out Euros to reimburse him .
NEGATIVE	When they came nobody was there we try to call the agency but no answer .
POSITIVE	When visiting such a lovely city why would not you want to see it all .
