NEGATIVE	It was very disappointing that having asked the tour organisers about Budva we were given incorrect information .
NEGATIVE	It was very disorganized , we ended up at a mall and lost our 2 hours in Kotor .
NEGATIVE	It was way too hot and boring to recommend anyone to see .
POSITIVE	It was well worth it - the ride is smooth and the views are stunning .
POSITIVE	it was well worth the money , at the top you get great views of the old town , sit and have a Coffey or a beer and admire the view  .
POSITIVE	It will give you super view over the city .
NEGATIVE	it would be scary ! 
NEGATIVE	It would not have been so bad if he had given a simple apology , after all delays can happen .
NEGATIVE	its a 2 minute ride that costs 30 euros for 2 people back and forth , offers nothing amazing view wise , and its a bad photo op since the cables are in the way all the time .
POSITIVE	Its a former battle site from 1991 and I found some shrapnel - a proper , cracking souvenir .
POSITIVE	Its expensive for just the cable car , but if you take the time , have a meal at the top and just soak in the sights its well worth it .
POSITIVE	Its not often you get a wonderful seascape on one side , impressive mountain views on the other and a great view of the unique OldTownofDubrovnik and the surrounding area aswell .
POSITIVE	Journey too short but well worth it for the views at the top on a clear day .
POSITIVE	Just AMAZING .
POSITIVE	Just great !
NEGATIVE	JUST stay away from SelectDubrovnik if u dont want your vacation ruined .
POSITIVE	Just take a walk up there and you can take the most beautiful panoramas , group photos and selfies with a lovely sunset in the background .
POSITIVE	Kids loved it too  .
POSITIVE	Last minute decision on the way back to my apartment late one afternoon and found it v quiet .
NEGATIVE	Lastly company instead of helping us to compensate for the amount we paid is also not willing to refund the initial amount which was being charged to us , which shows clear intention of cheating clients by taking money in advance and not giving them services
NEGATIVE	Later in budva , she ' recommended ' a restaurant that she said was fast and best of town - WRONG !
NEGATIVE	Let down is an understatement .
NEGATIVE	Lift in the upper building is not working or permanently occupied by staff so you are limited to the arrival level .
NEGATIVE	Like most touristy things in Dubrovnik , it is overpriced and nothing special .
POSITIVE	Little bit of an uphill walk to the station BUTI assure you worth it for the stunning views as you travel of the old town , out to sea and the islands beyond .
POSITIVE	Little souvenir shop at top which our kids liked to buy a present in .
POSITIVE	Loads of photo opportunities .
POSITIVE	Lots of great displays and maps of the conflict with Serbia .
POSITIVE	Loved it .
POSITIVE	Loved the War museum , spent ages there .
POSITIVE	Loved the war museum at the top too .
POSITIVE	Loved using the cable car .
POSITIVE	Lovely cafe / restaurant at the top .
POSITIVE	Lovely cafe and panoramic Restaurant at the top , you can pre book tables there to watch the sun go down , well worth it .
POSITIVE	Lovely cafe at the top .
POSITIVE	Lovely cafe at the top too and what a view !
POSITIVE	Lovely panoramic restaurant also and bar .
POSITIVE	Lovely restaurant / bar at the top .
POSITIVE	Lovely restaurant at the top , we had lunch there .
POSITIVE	Lovely restaurant at the top and friendly staff - absolutely wonderful !
POSITIVE	Lovely restaurant at the top as well as a little shop .
POSITIVE	Lovely restaurant at the top aswell as a little shop .
POSITIVE	Lovely restaurant on top of mountain to enjoy a drink or something to eat .
POSITIVE	Lovely restaurant with well trained staff .
POSITIVE	Lovely ride up and down for a fantastic view of old town , Dubrovnik and the islands around it .
POSITIVE	Lovely ride up takes about 4 minutes and the view breath taking .
POSITIVE	Lovely terrace cafe at the top .
POSITIVE	Lovely travel mode
POSITIVE	Lovely views , and interesting museum .
POSITIVE	Lovely views of Dubrovnik !
POSITIVE	Lovely views over the old town and the sea .
POSITIVE	Lovely walks at the top , and a Museum of the recent war .
POSITIVE	Lovely warm breeze to escape the stifling heat from the city .
POSITIVE	Luckily we did not miss the sunset .
POSITIVE	Lucky that in this time of year is not busy so we had hill just for us , also great war museum worth visiting on the hill !
POSITIVE	Lunch in the cafe enjoying the sensational view was fantastic .
NEGATIVE	Magical Tours and our Tour Guide were abysmal .
POSITIVE	Make sure you get a really sunny day to get the great views and photos .
POSITIVE	Marvellous cafe at the top and the view down on to the city is absolutely stunning .
POSITIVE	Marvellous views across the Old town .
NEGATIVE	Massive queues at times .
NEGATIVE	More of an opportunity to take a picture from the top of the walls and ocean but , you can do this as you are leaving Dubrovnik as well .
NEGATIVE	Moreover , the price is very expensive ( 25‰âÂ/person ) and there is nothing to do in the top ( excluding a 4x4 offroad rides , if you are able to pay a lot ) .
POSITIVE	Morning is best for photographs but dinner and a sunset are equally enticing .
NEGATIVE	Most of the other tour guests were also suddenly told they would not be dropped off at the Pile Gate and were instead left at the cable car stop .
NEGATIVE	Much too pricey for two of us leta alone if you have children with you .
POSITIVE	Must do and see in Dubrovnik forsure !
POSITIVE	must do if you visit  .
POSITIVE	Must do whilst in the city !
POSITIVE	My 5 year old loved the cable car and the view is spectacular .
NEGATIVE	My advice is not to use them because it seems one could allege that there is a lack of integrity within their business .
POSITIVE	My elderly mother was traveling with us , and being able to go to the top with such stunning views was one of the highlights of our trip .
POSITIVE	My experience with DubrovnikCableCar was exhilarating !
POSITIVE	My husband enjoyed looking down on things asusual  .
NEGATIVE	My husband instantly blocked his card .
NEGATIVE	My parents took a view and said it not for them .
POSITIVE	My partner and I took the cable car up to have a nice dinner at the top .
NEGATIVE	My partner and I went on this day tour today and found the conduct of our tour guide to be rude and combatative from the beginning of our trip .
NEGATIVE	My partner and I were really looking forward to this but were left bitterly disappointed .
NEGATIVE	My personal opinion is that you should skip the top of the hill and spend your money on other aspects of dubrovnik .
NEGATIVE	My review is based on next facts : - wife bought for whole family ( 4 pax ) as a surprise tour over the Viator for 182 $ ( around 160 EUR ) while later we found out that same package is sold on their website for 120 EUR - this is not old FORD car , this is cheap replica that every second of the tour.
NEGATIVE	My seatbelt was not working properly and this was the same for my husband and the lady sat next to me .
NEGATIVE	My wife was very upset and doubt whether we were discriminated as we are Asian .
NEGATIVE	name of driver was Michael, I would not reccommend this transfer agency .
NEGATIVE	Needed to get a taxi from city centre to Panarama Restaurant and as cable car not working we needed to get a taxi .
NEGATIVE	Needless to say , our day was canceled .
POSITIVE	Needless to say , the swift cable car ride to the top is a pleasant change , and the fortress has been wonderfully revived as a museum and restaurant that give you amazing views down over the orange tiled roofs of the old city .
NEGATIVE	Needless to say due to the fact we were not given ANY prior notice our transfer was not turning up we missed our flight and had to wait 6 HOURS at the airport for the next flight .
NEGATIVE	Never again will choose Connecto because the do not connecto .
NEGATIVE	Never arrived .
POSITIVE	Never ridden in a cable car and did not want to miss this chance .
POSITIVE	Nice and fast , no queues , great views .
POSITIVE	Nice cafe at the top to have a coffee or drink .
POSITIVE	Nice Cafe up there to enjoy a nice lunch / dinner / afternoon ice cream .
POSITIVE	Nice journey .
POSITIVE	Nice little cafe bar too .
POSITIVE	Nice little cafe up there too so can sit & have drink while looking at the view .
POSITIVE	Nice looking restaurant at the top but had already eaten .
POSITIVE	Nice n tidy cable car with a smooth ride .
POSITIVE	Nice place for coffee and cake .
POSITIVE	Nice restaurant at the top , where you can just sit , eat , relax , enjoy .
POSITIVE	Nice restaurant with tables overlooking the old town .
POSITIVE	Nice smooth ride up , took about 5 minutes .
POSITIVE	Nice sun set view location .
POSITIVE	Nice to stay and have a coffe , beer or lunch .
POSITIVE	Nice view of the whole city of Dubrovnik .
POSITIVE	Nice way to see the area .
NEGATIVE	No , I said , I have messages to prove it .
NEGATIVE	No driver at Geneva airport .
NEGATIVE	No family tickets .
NEGATIVE	No further contact was received from them .
NEGATIVE	No one said anything , climbed up hill past closed ticket office .
NEGATIVE	No one said it was closed !
NEGATIVE	No thank you .
NEGATIVE	No thanks .
NEGATIVE	No tour guide .
NEGATIVE	No vehicle turned up .
POSITIVE	No visit to Dubrovnik is complete without a visit to the top of the mountain .
NEGATIVE	No worth it at all
NEGATIVE	Nobody called back .
NEGATIVE	Nor were we told that we would not be stopping for lunch until 3pm !
NEGATIVE	Not a pleasant experience on a hot day.
POSITIVE	Not alot to do / see at the summit , but you can always have a drink / meal at the PanoramaRestaurant .
POSITIVE	Not expensive and regular cars means for a quick ride up without waiting too long .
NEGATIVE	Not good for 4 adults and 2 kids and a lot of bags .
NEGATIVE	Not much to see on top .
POSITIVE	Not only do you get a spectacular view of Dubrovnik , but we were able to locate where we were staying in Lapad and also a beautiful hotel that we decided to go to for a drink at their pool area .
NEGATIVE	Not only would I suggest you do not ever use these companies but I will be taking the matter further to determine whether their behavior is fraudulent .
NEGATIVE	Not the best way to spend your money !
POSITIVE	Not to be missed , the greatest view of the old city and the surroundingS : ) .
POSITIVE	Not to be missed !
POSITIVE	Not to be missed .
NEGATIVE	Not to mention , once we got onto this HUGE bus ( instead of luxury van ) , the bus was TOO large to even fit in the street of our villa so we had to WALK .
NEGATIVE	Not very customer friendly .
NEGATIVE	Not worth ‰âÂ20 return though for the cart .
NEGATIVE	Not worth it .
NEGATIVE	Not worth it really .
NEGATIVE	Not worth money as only on 3 minutes and the que was 45 mins long .
NEGATIVE	Not worth spending the money , in my view .
NEGATIVE	Not worth the hassle , save your money for a nice meal .
NEGATIVE	Not worth waiting for forty minutes while the operator takes her break and then calls you stupid for giving her the wrong paper .
POSITIVE	Nothing much at the top worth visiting but just a fantastic panorama .
POSITIVE	Nothing much to add , but the views were absolutely stunning !
NEGATIVE	Nothing much up there .
NEGATIVE	Nothing to see from the top but red brick roof top houses .
NEGATIVE	Nothing was said in the reviews about how hot mostar actually is .
POSITIVE	Obviously , you do this to enjoy a fantastic view of Dubrovnik and surroundings ( we clearly distinguished our hotel in BabinKuk ) .
POSITIVE	Of course there were great views from up here so took lots of pics and avoided being attacked by all of the selfie-sticks .
POSITIVE	Offers a great view over the city and out to sea .
POSITIVE	Offers a really terrific view of the city and surroundings .
POSITIVE	Offers lovely view of the old city , the best time of the day is right before the sun goes down sothat you can see both the morning view and the night view from the top of the city .
POSITIVE	On a clear , fine day the views from the top are wonderful .
POSITIVE	On a clear day you can see this superb area for miles , and see the old city in all of its glory .
POSITIVE	On a clear sunny day the views over the old city and the coastline are stunning .
NEGATIVE	On argument the driver threatened us to take us to police .
NEGATIVE	On hesitation he was more eager to have the money and asked again .
NEGATIVE	On leaving the restaurant a taxi was called for us , for this journey we were only charged 150 Kuna ‰Ûª s half of what we were charged by Dino - if you don ‰Ûª t want to be conned avoid this taxi driver at all cost .
NEGATIVE	On our visit we were told that the queue would only take 20 minutes , but people at the front told us they were waiting more than an hour .
NEGATIVE	On return journey the operator unexpectedly advised passengers they could not take the return journey and should either walk down or take a taxi .
NEGATIVE	On the first leg , the driver was 40 minutes late meeting us at Geneva Airport .
POSITIVE	On the hike , you are able to see crosses and stone carvings illustrating the pilgrimage in the past .
NEGATIVE	On the return leg , the driver did not show up at the agreed time .
NEGATIVE	On the return transfer the driver was not able to install the car seat and got it stuck half in .
POSITIVE	On the top there are 2 terraces , so the higher one is better for pictures .
POSITIVE	On the up , there are better views when you go other side the museum from cablecar station .
NEGATIVE	On the way back , she was slow to answer any questions or concerns because she was too busy reclining on the front seat and reading her book .
NEGATIVE	On the way back they were over 2 hours late and did not provide a suitable car seat for my 3 year old son .
NEGATIVE	On the way home our Guide and Busdriver had a long , loud and annoying conversation .
NEGATIVE	On top there is a civil war museum that was small and not very interesting .
NEGATIVE	Once 30 minutes late and the other just never showed up .
POSITIVE	Once at the top , the views are spectacular all round .
POSITIVE	Once at the top , there is beauty all around you , so bring your camera for the photos of a lifetime .
POSITIVE	Once at the top , walk all around to fully appreciate the views .
POSITIVE	Once at the top , you have a few different view points , plus a nice ( non-tourist trap ) panorama cafe .
POSITIVE	Once at the top it is possible to go for long walks but the view is absolutely exceptional .
POSITIVE	Once at the top the views are great of the old town of Dubrovnik .
POSITIVE	Once at the top walk along the back of the fortress and you will see many people taking in the beautiful sunset .
POSITIVE	Once at top those views are even better .
POSITIVE	Once there , the views are spectacular of the old city and for many miles in several directions .
POSITIVE	Once up at the top the views are spectacular .
POSITIVE	Once up there the views are fantastic and well worth the wait .
POSITIVE	Once up too there are many places to get different views and great photo opportunities .
POSITIVE	Once we arrived at the top we spent time taking photographs and generally enjoyed our time up there .
NEGATIVE	Once you ‰Ûª re up there , you can ‰Ûª t get good pictures as the cable car pylons rare in the way .
POSITIVE	Once you are up there , there is a restaurant called the panoramic and a small museum ( tickets can also be purchased ) which is worth a visit .
NEGATIVE	Once you are up there you will have nowhere to sit apart from at their own restaurant .
POSITIVE	Once you arrive take a detour and visit the fort which has an exhibition to honor the defenders of Dubrovnik .
POSITIVE	Once you get there there is a lovely restaurant for drinks or eating with panoramic views .
NEGATIVE	Once you go up its even a worse line to go down .
POSITIVE	One can also see the spectacular mountains of Bosnia-Herzegovina on the other side from the top and these are almost as impressive a sight .
POSITIVE	One of the best places to get a great photo of the OldCity -- and a selfie !
POSITIVE	one posing for photos !
NEGATIVE	Only 2 cars and they were overcrowded .
NEGATIVE	Only if you are a photo freak you should spend so much to make a 3m up and down ride, the distance covered os too short and nothing special to offer !
NEGATIVE	Only on checking with our back we realised the full money was not refunded and only on then asking the company they started mentioning cancellation charges !
NEGATIVE	Operator was very rude and incosiderate to how the passengers would return back to the start point .
POSITIVE	Order a bottle of good wine and watch the day turn into night and enjoy a view of the city lights .
POSITIVE	Our cable car was busy but views from the top were worth it !
NEGATIVE	Our car was not as we booked - we had booked a luxury catagory and we got sent a tiny Renault .
POSITIVE	Our cruise ship came into Dubrovnik , and after walking around this beautiful city , we decided to take the cable car ride up for the breathing panoramic views .
NEGATIVE	Our driver did not provide any info during the trip at all .
NEGATIVE	Our driver was awful, and the driving was unacceptable .
NEGATIVE	Our driver was Russian , spoke NO English or French , not one word .
NEGATIVE	Our guide , Marinara , was not engaging with the group ( such as inviting questions or asking what our interests were ) .
NEGATIVE	Our of curiosity I went online to get another quote and was still quoted the original 92 EURO .
NEGATIVE	Our rental car company fitted our seat properly without me asking so I do not think it is unreasonable .
NEGATIVE	Our tour guide started off by announcing the rules of the trip eg " no talking whilst I am talking " , and " I demand respect ... " .
POSITIVE	Out of all the things to do in Dubrovnik , the cable car seems expensive ‰Û_ but really , it ‰Ûª s so worth it if you have the time .
POSITIVE	Outside the walls by the PloceGate is a station for a high speed cable car gondola that takes you up to the top of SrdHill ( serge ) which offers incredible views of the old city and the surrounding area .
POSITIVE	Over all the view was beautiful and this clear sunny day and well worth the ride up .
NEGATIVE	Over in a jiffy packed in like sardines .
NEGATIVE	Over priced , packed and in my opinion , not worth it !
NEGATIVE	Overall , I feel like I barely saw or learned anything today and was mostly just in a hurry to make the most of my limited time .
NEGATIVE	Overall , If you want to take a tour with a boring guide holding a history lesson , than this tour 100 % suit you .
NEGATIVE	Overall good reviews but my advice is if you need a taxi , hire a car instead .
NEGATIVE	Overall very stressful and inferior service - I certainly would NOT use them again and would NOT recommend !
POSITIVE	Pack a bottle of wine , make sure your cell phone is charged / has space for ample photos , because this will be one of the most beautiful things you have ever seen .
POSITIVE	Panorama Restaurant is good .
NEGATIVE	Pathetic drivers and services .
POSITIVE	Pay the 120kuna , approx å£13 to top and back down , less if you walk down and enjoy the sights .
NEGATIVE	Paying 570kuna ( 85Usd ) for a return trip is just not worth it .
POSITIVE	Personally do not think either the entrance fee or restaurant were over priced at all .
NEGATIVE	Pick up 40 minutes late on both outward and return journeys .
NEGATIVE	Pick up from the apartment ( which had been booked at the same time as airport pick up ) was also late , again I had to cross the road and walk to the aforementioned bakery where the driver was sat on his phone .
NEGATIVE	Pity .
NEGATIVE	Please avoid this company they are unreliable , unprofessional and more importantly dangerous .
NEGATIVE	Please do not do this trip if you are elderly , pregnant or have small children as the amount of time spent on the bus is ridiculous and whilst the falls and Mostar are nice ... you would be better hiring a car and doing this tour at your own pace .
NEGATIVE	Please DO NOT use this company .
NEGATIVE	Please think twice before booking with this company , Connecto Transfers .
POSITIVE	Plenty of different platforms to view Dubrovnik .
POSITIVE	Plus are two lovely restaurants at the top  .
NEGATIVE	Preordered minivan driver arrived 45 minutes late .
NEGATIVE	Pretty much a scam for me though , only a restaurant on top of the hill .
POSITIVE	Priceless .
POSITIVE	Probably should be the first thing you do in Dubrovnik .
POSITIVE	Probably the best way to view dubrovnik old town , reasonably priced and well worth a visit .
NEGATIVE	Probably the only time we felt ripped off this trip .
POSITIVE	Provides a great perspective and wonderful photo opportunities .
POSITIVE	Provides a reality check on the many post cards purchased that do truely reflect the area .
NEGATIVE	Put simply the cost of the cable car left a sour taste and spoilt the whole experience .
NEGATIVE	Queue jumping is basically encouraged and groups given priority over those who have been waiting for 15-30 mins .
POSITIVE	Quick and easy .
NEGATIVE	Quite expensive , and although the view was good from the top it seems like a bit of a rip off .
POSITIVE	Quite expensive but lovely perspective from up above .
POSITIVE	Quite simply a must for anyone who loves a good view .
POSITIVE	Really enhanced our visit .
POSITIVE	Really enjoyed taking the cable car to the top .
POSITIVE	Really enjoyed this as fantastic views over the city 150 kuna a ticket nice restaurant at the top and magnificent views over the city so great for pics .
POSITIVE	Really good .
POSITIVE	Really good queuing system for when it gets busy , ensures not too many people are packed into one cable car and keeps everyone orderly .
NEGATIVE	Really hiking prices to cash in on Game of Thrones and Cruise Ships
POSITIVE	Really lovely .
POSITIVE	Really nice to sit and enjoy a coffee while taking in the views .
NEGATIVE	Really think carefully before booking these types of tours .
POSITIVE	Reasonable price aswell .
POSITIVE	Reasonably priced and a one way ticket gives you the opportunity to walk back down .
POSITIVE	Reasonably priced and clean modern cable car Panorama restaurant at the top has the most amazing views of dubrovnik and worth a stay for coffee on the terrace .
POSITIVE	Reconstruction cost $12 billion , and it was worth every penny , and every cent was spent in good taste .
NEGATIVE	Refund promised , but what are the chances ?
POSITIVE	Restaurant is nice aswell .
POSITIVE	Restaurant located outside is pricey but well worth a visit even for a drink and to sit down and take in the stunning scenery .
POSITIVE	Restaurant up at the top where you can have a meal or drinks with great views .
POSITIVE	Ride up the mountain provides an excellent view of the OldTown and the surrounding area .
NEGATIVE	Rip off
POSITIVE	Rode up one evening to capture the sunset and take in the view whilst enjoying a wonderful dinner .
NEGATIVE	Ruined our day and stay in Split .
NEGATIVE	Sadly our driver left a lot to desire for , we were traveling from New York - not carrying euros or Kuna ; therefore I had to make a quick stop to exchange money at the airport , was not given an option to pay prior to arrival Sent my husband to meet the drive.
NEGATIVE	Save your moeny .
NEGATIVE	save your money and spend it on something else
NEGATIVE	Save your money and spend it on the entry fee to the wall .
NEGATIVE	Save yourself stress , time and ALOT of cash and book with someone else .
NEGATIVE	Second island was disappointing and by the time we walked to the end of the harbour it was time to board again .
NEGATIVE	Secondly they are not transparent with their cancellation charges .
POSITIVE	See the luxury yachts anchored in the bay and the old town from above .
POSITIVE	See the old city , the outer city , the many islands and a beautiful Adriatic sea .
NEGATIVE	Seriously this is an overrated place .
POSITIVE	Service is very efficient it appears they run approximately every five minutes .
NEGATIVE	Shame on you guys at connecto-taxi .
NEGATIVE	Shame you n you Conecto
NEGATIVE	She didn ‰Ûª t give anyone her phone number , and her instructions on where to meet or what we were doing were unclear at best .
NEGATIVE	She has not requested other people to change seats .
NEGATIVE	She is horrible, like a history teacher to repeat the information that you can find on the internet .
NEGATIVE	She just repeated " u wait for the next coach " and drove away ( again the " you are none of my business " attitude ) , leaving me and my wife on the road shocked and didnt know what to do .
NEGATIVE	She kept complaining about how much work she had to do to get us through the border .
NEGATIVE	She looked worried and panicked for most of the trip .
NEGATIVE	She rudely told us " you want to go with us or not , if not go and get the refund " , I chose to have my refund because the price and itinerary of the big coach n minibus tours are completely different , and I didnt want to compromise given their rude n careless attitude .
NEGATIVE	She says that , as we took a tour on the same bus the day before and we already knew we would be seated at the back , we should have said something earlier .
NEGATIVE	She says this would not be possible .
NEGATIVE	She then raised her voice and asked me to take my seat , noting that I am just one unhappy customer .
NEGATIVE	She was not pleasant .
NEGATIVE	She was probably getting commission for the guests , so she could not care less about what we saw and visited .
POSITIVE	Short , smooth ride ; not too expensive .
NEGATIVE	Simply appalling .
NEGATIVE	Simply because an incompetent cable car attendant decided it is more intelligent not to make a public announcement that this is the last trip going down .
POSITIVE	Simply breathtaking !
